{
  "schema_version": 1,
  "verdict": "approve",
  "prior_findings": [
    {
      "id": 1,
      "disposition": "verified",
      "note": "plan.md:82-86's Write Flow diagram now routes through `[src/core/db.ts: createFeature / updateFeatureStatus]` then `[src/core/db.ts: recordEvent]`, with no remaining reference to `src/core/state.ts`. The source tree entry for `src/cli.ts` (line 71) also now says it 'disables legacy state-mutating commands,' consistent with the rest of the plan."
    },
    {
      "id": 2,
      "disposition": "verified",
      "note": "tasks.md T014 step 9 (lines 148-151) now runs all three CLI commands (`start-feature`, `record-decision`, `record-manual-test`) and checks each fails closed. Step 10 (lines 152-153) loops over all three MCP tool names (`start_feature`, `record_decision`, `record_manual_test`) and checks each throws. Full coverage of what T013 disables."
    }
  ],
  "new_findings": []
}
